{
  "source": {
    "retrievedAt": "2026-08-17T14:09:47.723768Z",
    "url": "https://raw.githubusercontent.com/safedep/shai-hulud-migration-response/main/data/ioc/malicious-package-versions.jsonl",
    "contentHash": "60ae35aea3561d7809f0ca160d5c40c911a7028e848cc67b60e6d5f11069b481",
    "runId": "32038038876"
  },
  "packages": [
    {
      "name": "02-echo",
      "versions": [
        "0.0.7"
      ]
    },
    {
      "name": "@accordproject/concerto-analysis",
      "versions": [
        "3.24.1"
      ]
    },
    {
      "name": "@accordproject/concerto-linter",
      "versions": [
        "3.24.1"
      ]
    },
    {
      "name": "@accordproject/concerto-linter-default-ruleset",
      "versions": [
        "3.24.1"
      ]
    },
    {
      "name": "@accordproject/concerto-metamodel",
      "versions": [
        "3.12.5"
      ]
    },
    {
      "name": "@accordproject/concerto-types",
      "versions": [
        "3.24.1"
      ]
    },
    {
      "name": "@accordproject/markdown-it-cicero",
      "versions": [
        "0.16.26"
      ]
    },
    {
      "name": "@accordproject/template-engine",
      "versions": [
        "2.7.2"
      ]
    },
    {
      "name": "@actbase/css-to-react-native-transform",
      "versions": [
        "1.0.3"
      ]
    },
    {
      "name": "@actbase/native",
      "versions": [
        "0.1.32"
      ]
    },
    {
      "name": "@actbase/node-server",
      "versions": [
        "1.1.19"
      ]
    },
    {
      "name": "@actbase/react-absolute",
      "versions": [
        "0.8.3"
      ]
    },
    {
      "name": "@actbase/react-daum-postcode",
      "versions": [
        "1.0.5"
      ]
    },
    {
      "name": "@actbase/react-kakaosdk",
      "versions": [
        "0.9.27"
      ]
    },
    {
      "name": "@actbase/react-native-actionsheet",
      "versions": [
        "1.0.3"
      ]
    },
    {
      "name": "@actbase/react-native-devtools",
      "versions": [
        "0.1.3"
      ]
    },
    {
      "name": "@actbase/react-native-fast-image",
      "versions": [
        "8.5.13"
      ]
    },
    {
      "name": "@actbase/react-native-kakao-channel",
      "versions": [
        "1.0.2"
      ]
    },
    {
      "name": "@actbase/react-native-kakao-navi",
      "versions": [
        "2.0.4"
      ]
    },
    {
      "name": "@actbase/react-native-less-transformer",
      "versions": [
        "1.0.6"
      ]
    },
    {
      "name": "@actbase/react-native-naver-login",
      "versions": [
        "1.0.1"
      ]
    },
    {
      "name": "@actbase/react-native-simple-video",
      "versions": [
        "1.0.13"
      ]
    },
    {
      "name": "@actbase/react-native-tiktok",
      "versions": [
        "1.1.3"
      ]
    },
    {
      "name": "@afetcan/api",
      "versions": [
        "0.0.13"
      ]
    },
    {
      "name": "@afetcan/storage",
      "versions": [
        "0.0.27"
      ]
    },
    {
      "name": "@ahmedhfarag/ngx-perfect-scrollbar",
      "versions": [
        "20.0.20"
      ]
    },
    {
      "name": "@ahmedhfarag/ngx-virtual-scroller",
      "versions": [
        "4.0.4"
      ]
    },
    {
      "name": "@alaan/s2s-auth",
      "versions": [
        "2.0.3"
      ]
    },
    {
      "name": "@alexadark/amadeus-api",
      "versions": [
        "1.0.4"
      ]
    },
    {
      "name": "@alexadark/gatsby-theme-events",
      "versions": [
        "1.0.1"
      ]
    },
    {
      "name": "@alexadark/gatsby-theme-wordpress-blog",
      "versions": [
        "2.0.1"
      ]
    },
    {
      "name": "@alexadark/reusable-functions",
      "versions": [
        "1.5.1"
      ]
    },
    {
      "name": "@alexcolls/nuxt-socket.io",
      "versions": [
        "0.0.7",
        "0.0.8"
      ]
    },
    {
      "name": "@alexcolls/nuxt-ux",
      "versions": [
        "0.6.1",
        "0.6.2"
      ]
    },
    {
      "name": "@antstackio/eslint-config-antstack",
      "versions": [
        "0.0.3"
      ]
    },
    {
      "name": "@antstackio/express-graphql-proxy",
      "versions": [
        "0.2.8"
      ]
    },
    {
      "name": "@antstackio/graphql-body-parser",
      "versions": [
        "0.1.1"
      ]
    },
    {
      "name": "@antstackio/json-to-graphql",
      "versions": [
        "1.0.3"
      ]
    },
    {
      "name": "@antstackio/shelbysam",
      "versions": [
        "1.1.7"
      ]
    },
    {
      "name": "@art-ws/common",
      "versions": [
        "2.0.28"
      ]
    },
    {
      "name": "@art-ws/config-eslint",
      "versions": [
        "2.0.4",
        "2.0.5"
      ]
    },
    {
      "name": "@art-ws/config-ts",
      "versions": [
        "2.0.7",
        "2.0.8"
      ]
    },
    {
      "name": "@art-ws/db-context",
      "versions": [
        "2.0.24"
      ]
    },
    {
      "name": "@art-ws/di",
      "versions": [
        "2.0.28",
        "2.0.32"
      ]
    },
    {
      "name": "@art-ws/di-node",
      "versions": [
        "2.0.13"
      ]
    },
    {
      "name": "@art-ws/eslint",
      "versions": [
        "1.0.5",
        "1.0.6"
      ]
    },
    {
      "name": "@art-ws/fastify-http-server",
      "versions": [
        "2.0.24",
        "2.0.27"
      ]
    },
    {
      "name": "@art-ws/http-server",
      "versions": [
        "2.0.21",
        "2.0.25"
      ]
    },
    {
      "name": "@art-ws/openapi",
      "versions": [
        "0.1.12",
        "0.1.9"
      ]
    },
    {
      "name": "@art-ws/package-base",
      "versions": [
        "1.0.5",
        "1.0.6"
      ]
    },
    {
      "name": "@art-ws/prettier",
      "versions": [
        "1.0.5",
        "1.0.6"
      ]
    },
    {
      "name": "@art-ws/slf",
      "versions": [
        "2.0.15",
        "2.0.22"
      ]
    },
    {
      "name": "@art-ws/ssl-info",
      "versions": [
        "1.0.10",
        "1.0.9"
      ]
    },
    {
      "name": "@art-ws/web-app",
      "versions": [
        "1.0.3",
        "1.0.4"
      ]
    },
    {
      "name": "@aryanhussain/my-angular-lib",
      "versions": [
        "0.0.23"
      ]
    },
    {
      "name": "@asyncapi/avro-schema-parser",
      "versions": [
        "3.0.25",
        "3.0.26"
      ]
    },
    {
      "name": "@asyncapi/bundler",
      "versions": [
        "0.6.5",
        "0.6.6"
      ]
    },
    {
      "name": "@asyncapi/cli",
      "versions": [
        "4.1.2",
        "4.1.3"
      ]
    },
    {
      "name": "@asyncapi/converter",
      "versions": [
        "1.6.3",
        "1.6.4"
      ]
    },
    {
      "name": "@asyncapi/diff",
      "versions": [
        "0.5.1",
        "0.5.2"
      ]
    },
    {
      "name": "@asyncapi/dotnet-rabbitmq-template",
      "versions": [
        "1.0.1",
        "1.0.2"
      ]
    },
    {
      "name": "@asyncapi/edavisualiser",
      "versions": [
        "1.2.1",
        "1.2.2"
      ]
    },
    {
      "name": "@asyncapi/generator",
      "versions": [
        "2.8.5",
        "2.8.6"
      ]
    },
    {
      "name": "@asyncapi/generator-components",
      "versions": [
        "0.3.2",
        "0.3.3"
      ]
    },
    {
      "name": "@asyncapi/generator-helpers",
      "versions": [
        "0.2.1",
        "0.2.2"
      ]
    },
    {
      "name": "@asyncapi/generator-react-sdk",
      "versions": [
        "1.1.4",
        "1.1.5"
      ]
    },
    {
      "name": "@asyncapi/go-watermill-template",
      "versions": [
        "0.2.76",
        "0.2.77"
      ]
    },
    {
      "name": "@asyncapi/html-template",
      "versions": [
        "3.3.2",
        "3.3.3"
      ]
    },
    {
      "name": "@asyncapi/java-spring-cloud-stream-template",
      "versions": [
        "0.13.5",
        "0.13.6"
      ]
    },
    {
      "name": "@asyncapi/java-spring-template",
      "versions": [
        "1.6.1",
        "1.6.2"
      ]
    },
    {
      "name": "@asyncapi/java-template",
      "versions": [
        "0.3.5",
        "0.3.6"
      ]
    },
    {
      "name": "@asyncapi/keeper",
      "versions": [
        "0.0.2",
        "0.0.3"
      ]
    },
    {
      "name": "@asyncapi/markdown-template",
      "versions": [
        "1.6.8",
        "1.6.9"
      ]
    },
    {
      "name": "@asyncapi/modelina",
      "versions": [
        "5.10.2",
        "5.10.3"
      ]
    },
    {
      "name": "@asyncapi/modelina-cli",
      "versions": [
        "5.10.2",
        "5.10.3"
      ]
    },
    {
      "name": "@asyncapi/multi-parser",
      "versions": [
        "2.2.1",
        "2.2.2"
      ]
    },
    {
      "name": "@asyncapi/nodejs-template",
      "versions": [
        "3.0.5",
        "3.0.6"
      ]
    },
    {
      "name": "@asyncapi/nodejs-ws-template",
      "versions": [
        "0.10.1",
        "0.10.2"
      ]
    },
    {
      "name": "@asyncapi/nunjucks-filters",
      "versions": [
        "2.1.1",
        "2.1.2"
      ]
    },
    {
      "name": "@asyncapi/openapi-schema-parser",
      "versions": [
        "3.0.25",
        "3.0.26"
      ]
    },
    {
      "name": "@asyncapi/optimizer",
      "versions": [
        "1.0.5",
        "1.0.6"
      ]
    },
    {
      "name": "@asyncapi/parser",
      "versions": [
        "3.4.1",
        "3.4.2"
      ]
    },
    {
      "name": "@asyncapi/php-template",
      "versions": [
        "0.1.1",
        "0.1.2"
      ]
    },
    {
      "name": "@asyncapi/problem",
      "versions": [
        "1.0.1",
        "1.0.2"
      ]
    },
    {
      "name": "@asyncapi/protobuf-schema-parser",
      "versions": [
        "3.5.2",
        "3.5.3",
        "3.6.1"
      ]
    },
    {
      "name": "@asyncapi/python-paho-template",
      "versions": [
        "0.2.14",
        "0.2.15"
      ]
    },
    {
      "name": "@asyncapi/react-component",
      "versions": [
        "2.6.6",
        "2.6.7"
      ]
    },
    {
      "name": "@asyncapi/server-api",
      "versions": [
        "0.16.24",
        "0.16.25"
      ]
    },
    {